{
  "name": "assemble-report",
  "type": "script",
  "category": "assembly",
  "description": "将分析骨架 (skeleton.html) 与动态内容组装为完整报告 HTML",
  "invocation": "node agent-tools/scripts/assemble-report.mjs <skeleton.html> <output.html>",
  "parameters": {
    "skeleton_path": { "type": "string", "required": true, "description": "骨架 HTML 模板路径" },
    "output_path": { "type": "string", "required": true, "description": "输出完整报告 HTML 路径" }
  },
  "returns": { "type": "string", "description": "组装完成的报告 HTML 内容" },
  "exitCodes": { "0": "组装成功", "1": "骨架模板或数据源缺失" },
  "mandatory": false,
  "stageUsage": ["stage-7b"]
}
